[
  {
    "iter": 1,
    "parameters": [
      6e-07,
      6e-07,
      6e-07,
      6e-07,
      6e-07,
      8e-07,
      4e-07,
      4e-06,
      1e-05,
      6e-06,
      6e-06,
      8e-06,
      8e-06,
      1.2e-05,
      4.0,
      3.0,
      3.0,
      8.0,
      8e-13
    ],
    "performance": [
      0.0006905,
      104.4,
      101.6,
      110.9,
      3.026,
      102.4,
      0.000556,
      3.081e-08,
      -0.5641,
      475000000.0,
      74.69
    ],
    "validation": 136.6506905,
    "objective": 0.0006905,
    "violations": 136.65
  },
  {
    "iter": 7,
    "parameters": [
      9e-07,
      7e-07,
      1e-06,
      7e-07,
      6.5e-07,
      8e-07,
      4e-07,
      4e-06,
      1e-05,
      1.5e-05,
      6e-06,
      1.3e-05,
      8e-06,
      2e-05,
      4.0,
      3.0,
      3.0,
      9.0,
      1.04e-12
    ],
    "performance": [
      0.0007225,
      111.5,
      107.8,
      115.9,
      2.931,
      98.9,
      0.0004674,
      3.613e-08,
      -0.533,
      373400000.0,
      75.95
    ],
    "validation": 110.0907225,
    "objective": 0.0007225,
    "violations": 110.09
  },
  {
    "iter": 8,
    "parameters": [
      9e-07,
      7e-07,
      1e-06,
      7e-07,
      6.5e-07,
      8e-07,
      4e-07,
      4e-06,
      1e-05,
      1.5e-05,
      6e-06,
      1.65e-05,
      8e-06,
      2e-05,
      4.0,
      3.0,
      3.0,
      9.0,
      8.3e-13
    ],
    "performance": [
      0.0007225,
      112.0,
      108.2,
      116.3,
      2.913,
      93.84,
      0.0004778,
      2.854e-08,
      -0.5661,
      362400000.0,
      70.52
    ],
    "validation": 85.6807225,
    "objective": 0.0007225,
    "violations": 85.68
  },
  {
    "iter": 9,
    "parameters": [
      9e-07,
      7e-07,
      1e-06,
      7e-07,
      1e-06,
      8e-07,
      4e-07,
      4e-06,
      1e-05,
      4.5e-05,
      6e-06,
      1.65e-05,
      8e-06,
      2e-05,
      4.0,
      3.0,
      3.0,
      9.0,
      8.3e-13
    ],
    "performance": [
      0.0007124,
      99.89,
      95.65,
      103.1,
      2.837,
      86.53,
      0.0004468,
      3.247e-08,
      -0.5315,
      259300000.0,
      67.38
    ],
    "validation": 79.8432124,
    "objective": 0.0007124,
    "violations": 79.8425
  },
  {
    "iter": 10,
    "parameters": [
      9e-07,
      7e-07,
      1e-06,
      7e-07,
      1e-06,
      8e-07,
      4e-07,
      4e-06,
      1.5e-05,
      4.5e-05,
      6e-06,
      1.65e-05,
      8e-06,
      2e-05,
      4.0,
      6.0,
      3.0,
      9.0,
      1.1e-12
    ],
    "performance": [
      0.0008125,
      96.46,
      92.12,
      99.77,
      2.9,
      77.64,
      0.0003553,
      2.759e-08,
      -0.5697,
      216400000.0,
      45.83
    ],
    "validation": 41.95581250000005,
    "objective": 0.0008125,
    "violations": 41.95500000000005
  },
  {
    "iter": 15,
    "parameters": [
      9e-07,
      5e-07,
      1e-06,
      7e-07,
      1e-06,
      8e-07,
      4e-07,
      4e-06,
      2.5e-05,
      4.5e-05,
      6e-06,
      1.65e-05,
      8e-06,
      2e-05,
      4.0,
      6.0,
      3.0,
      9.0,
      1.35e-12
    ],
    "performance": [
      0.0008125,
      96.4,
      92.07,
      99.71,
      2.899,
      79.66,
      0.0003183,
      3.423e-08,
      -0.5323,
      220600000.0,
      52.03
    ],
    "validation": 35.73831250000003,
    "objective": 0.0008125,
    "violations": 35.737500000000026
  },
  {
    "iter": 16,
    "parameters": [
      9e-07,
      5e-07,
      1e-06,
      7e-07,
      1e-06,
      8e-07,
      4e-07,
      4e-06,
      2.5e-05,
      4.5e-05,
      6e-06,
      1.65e-05,
      8e-06,
      2e-05,
      4.0,
      5.0,
      3.0,
      9.0,
      1.26e-12
    ],
    "performance": [
      0.0007792,
      97.4,
      93.08,
      100.7,
      2.867,
      81.39,
      0.0003276,
      3.364e-08,
      -0.5415,
      233500000.0,
      58.25
    ],
    "validation": 27.950779200000003,
    "objective": 0.0007792,
    "violations": 27.950000000000003
  },
  {
    "iter": 17,
    "parameters": [
      9e-07,
      5e-07,
      1e-06,
      6e-07,
      1e-06,
      8e-07,
      4e-07,
      4e-06,
      2.5e-05,
      4.5e-05,
      6e-06,
      1.8e-05,
      8e-06,
      2e-05,
      4.0,
      5.0,
      3.0,
      9.0,
      1.26e-12
    ],
    "performance": [
      0.0007822,
      99.73,
      95.95,
      104.4,
      2.85,
      80.65,
      0.0003304,
      3.225e-08,
      -0.5481,
      231900000.0,
      59.55
    ],
    "validation": 12.263282200000003,
    "objective": 0.0007822,
    "violations": 12.262500000000003
  },
  {
    "iter": 18,
    "parameters": [
      9e-07,
      5e-07,
      1e-06,
      5.5e-07,
      1e-06,
      8e-07,
      4e-07,
      4e-06,
      2.5e-05,
      4.5e-05,
      6e-06,
      2e-05,
      8e-06,
      2e-05,
      4.0,
      5.0,
      3.0,
      9.0,
      1.26e-12
    ],
    "performance": [
      0.000783,
      101.1,
      97.67,
      106.7,
      2.837,
      80.19,
      0.0003318,
      3.099e-08,
      -0.5524,
      230300000.0,
      60.49
    ],
    "validation": 4.950783000000022,
    "objective": 0.000783,
    "violations": 4.9500000000000215
  },
  {
    "iter": 20,
    "parameters": [
      9e-07,
      5e-07,
      1e-06,
      5e-07,
      1e-06,
      8e-07,
      4e-07,
      4.2e-06,
      2.5e-05,
      4.5e-05,
      6e-06,
      2e-05,
      8e-06,
      2e-05,
      4.0,
      5.0,
      3.0,
      9.0,
      1.26e-12
    ],
    "performance": [
      0.0007835,
      102.2,
      99.12,
      108.9,
      2.825,
      79.98,
      0.0003351,
      3.071e-08,
      -0.5544,
      229300000.0,
      61.57
    ],
    "validation": 3.6107835000000232,
    "objective": 0.0007835,
    "violations": 3.6100000000000234
  },
  {
    "iter": 21,
    "parameters": [
      9e-07,
      5e-07,
      1e-06,
      5e-07,
      1e-06,
      8e-07,
      4e-07,
      4.2e-06,
      2.5e-05,
      4.5e-05,
      6e-06,
      2.1e-05,
      8e-06,
      2e-05,
      4.0,
      5.0,
      3.0,
      9.0,
      1.26e-12
    ],
    "performance": [
      0.0007835,
      102.3,
      99.23,
      109.0,
      2.825,
      79.89,
      0.0003347,
      3.066e-08,
      -0.5549,
      228800000.0,
      61.56
    ],
    "validation": 3.3007835000000028,
    "objective": 0.0007835,
    "violations": 3.300000000000003
  },
  {
    "iter": 22,
    "parameters": [
      9e-07,
      5e-07,
      1e-06,
      5e-07,
      1e-06,
      8e-07,
      4e-07,
      4.2e-06,
      2.5e-05,
      4.5e-05,
      6e-06,
      2.1e-05,
      8e-06,
      2e-05,
      4.0,
      5.0,
      3.0,
      9.0,
      1.22e-12
    ],
    "performance": [
      0.0007835,
      102.3,
      99.23,
      109.0,
      2.825,
      79.13,
      0.0003385,
      2.935e-08,
      -0.5607,
      226700000.0,
      60.39
    ],
    "validation": 2.1007834999999857,
    "objective": 0.0007835,
    "violations": 2.099999999999986
  },
  {
    "iter": 24,
    "parameters": [
      9e-07,
      5e-07,
      1e-06,
      5e-07,
      1e-06,
      8e-07,
      4e-07,
      4.2e-06,
      2.625e-05,
      4.5e-05,
      6.5e-06,
      2.1e-05,
      8e-06,
      2e-05,
      4.0,
      5.0,
      3.0,
      9.0,
      1.26e-12
    ],
    "performance": [
      0.0007847,
      102.9,
      100.0,
      110.3,
      2.823,
      79.56,
      0.0003356,
      3.034e-08,
      -0.5559,
      225800000.0,
      61.45
    ],
    "validation": 2.0607847000000175,
    "objective": 0.0007847,
    "violations": 2.0600000000000174
  },
  {
    "iter": 25,
    "parameters": [
      9e-07,
      5e-07,
      1e-06,
      5e-07,
      1e-06,
      8e-07,
      4e-07,
      4.2e-06,
      3.1e-05,
      4.5e-05,
      6.5e-06,
      2.1e-05,
      8e-06,
      2e-05,
      4.0,
      5.0,
      3.0,
      9.0,
      1.26e-12
    ],
    "performance": [
      0.0007847,
      102.9,
      100.0,
      110.3,
      2.823,
      79.07,
      0.000334,
      3.014e-08,
      -0.5571,
      216700000.0,
      60.54
    ],
    "validation": 0.7007846999999996,
    "objective": 0.0007847,
    "violations": 0.6999999999999996
  },
  {
    "iter": 26,
    "parameters": [
      9e-07,
      5e-07,
      1e-06,
      4.8e-07,
      1e-06,
      8e-07,
      4e-07,
      4.2e-06,
      3.1e-05,
      4.5e-05,
      6.5e-06,
      2.1e-05,
      8e-06,
      2e-05,
      4.0,
      5.0,
      3.0,
      9.0,
      1.26e-12
    ],
    "performance": [
      0.0007844,
      103.1,
      100.4,
      111.0,
      2.819,
      79.03,
      0.000335,
      3.007e-08,
      -0.5576,
      216500000.0,
      61.05
    ],
    "validation": 0.35078439999999983,
    "objective": 0.0007844,
    "violations": 0.3499999999999998
  },
  {
    "iter": 29,
    "parameters": [
      9e-07,
      4.9e-07,
      1e-06,
      4.8e-07,
      1e-06,
      8e-07,
      4e-07,
      4.2e-06,
      3.1e-05,
      4.5e-05,
      6.5e-06,
      2.1e-05,
      8e-06,
      2e-05,
      4.0,
      5.0,
      3.0,
      9.0,
      1.26e-12
    ],
    "performance": [
      0.0007844,
      103.1,
      100.4,
      111.0,
      2.819,
      78.95,
      0.0003345,
      2.998e-08,
      -0.5577,
      217200000.0,
      61.05
    ],
    "validation": 0.0007844,
    "objective": 0.0007844,
    "violations": 0.0
  },
  {
    "iter": 30,
    "parameters": [
      9e-07,
      4.9e-07,
      1e-06,
      4.8e-07,
      1e-06,
      8e-07,
      4e-07,
      3.99e-06,
      3.1e-05,
      4.5e-05,
      6.5e-06,
      2.1e-05,
      8e-06,
      2e-05,
      4.0,
      5.0,
      3.0,
      9.0,
      1.26e-12
    ],
    "performance": [
      0.0007843,
      103.1,
      100.4,
      111.0,
      2.821,
      78.95,
      0.0003338,
      2.997e-08,
      -0.5576,
      217600000.0,
      61.18
    ],
    "validation": 0.0007843,
    "objective": 0.0007843,
    "violations": 0.0
  }
]
